<assembly xmlns="http://www.typhoonframework.org/schema/assembly"
          xmlns:xsi="http://www.w3.org/2001/XMLSchema-instance"
          xsi:schemaLocation="http://www.typhoonframework.org/schema/assembly
          http://www.typhoonframework.org/schema/assembly.xsd">

    <component class="Knight" key="parent"></component>
    <component class="Knight" key="child" parent="parent"></component>

    <component class="Knight" key="childKnightWithConstructorDependency" parent="knightWithConstructorDependency"></component>
    <component class="Knight" key="knightWithConstructorDependency">
        <initializer selector="initWithQuest:">
            <argument parameterName="quest" ref="campaignQuest"></argument>
        </initializer>
    </component>
    <component class="CampaignQuest" key="campaignQuest"></component>

    <component class="Widget" key="widgetC">
        <initializer selector="initWithName:">
            <argument index="0" value="C" required-class="NSString"></argument>
        </initializer>
    </component>

    <component class="Widget" key="widgetB">
        <initializer selector="initWithName:">
            <argument index="0" value="B" required-class="NSString"></argument>
        </initializer>
    </component>

    <component class="Widget" key="widgetA">
        <initializer selector="initWithName:">
            <argument index="0" value="A" required-class="NSString"></argument>
        </initializer>
    </component>

    <component class="Widget" key="childWidgetWithDependencyOnCInheritingFromAandB" parent="widgetDependingOnAandB">
        <initializer selector="initWithWidgetC:">
            <argument index="0" ref="widgetC"></argument>
        </initializer>
    </component>

    <component class="Widget" key="widgetDependingOnAandB">
        <initializer selector="initWithWidgetA:widgetB:">
            <argument index="0" ref="widgetA"></argument>
            <argument index="1" ref="widgetB"></argument>
        </initializer>
    </component>
</assembly>
